[
  {
    "id": "openutau",
    "names": {
      "en": "OpenUtau"
    },
    "category": "host",
    "developers": [
      "Stakira"
    ],
    "homepage_url": "http://openutau.com/",
    "download_page_url": "https://github.com/stakira/OpenUtau/releases",
    "tags": [
      "host",
      "open-source",
      "openutau",
      "utau",
      "vogen",
      "enunu",
      "diffsinger",
      "windows",
      "mac",
      "linux"
    ]
  }
]
