[
    {
        "id": "vocaloid4",
        "names": {
            "en": "Vocaloid4"
        },
        "category": "host",
        "developers": [
            "Crypton Future Media, INC."
        ],
        "homepage_url": "https://www.vocaloid.com/",
        "file_url": null,
        "download_page_url": null,
        "tags": [
            "host"
        ]
    }
]